entry_id,amount,currency,record_type,time_period,source_label,source_url,custodian,what_it_proves,what_it_does_not_prove,calculation_status,publication_language,next_check
AID-001,298000000000,USD constant 2024 dollars,CRS cumulative obligations,1946-2024,"Congressional Research Service RL33222",https://www.congress.gov/crs-product/RL33222,"Congressional Research Service","CRS's inflation-adjusted estimate of cumulative U.S. obligations to Israel.","That a specific U.S. domestic program was directly displaced by this total.",source-stated,"CRS estimates inflation-adjusted U.S. aid obligations to Israel at $298B from 1946 through 2024.","Confirm CRS table and date in the latest report."
AID-002,174965000000,USD current dollars,CRS cumulative assistance and missile defense,through 2025,"Congressional Research Service RL33222",https://www.congress.gov/crs-product/RL33222,"Congressional Research Service","CRS's current-dollar cumulative figure through 2025.","The inflation-adjusted value or any single-year spend.",source-stated,"CRS separately reports $174.965B in current-dollar assistance and missile-defense funding through 2025.","Keep current-dollar and constant-dollar figures in separate rows."
AID-003,3800000000,USD per fiscal year,Memorandum of Understanding baseline,FY2019-FY2028,"Congressional Research Service RL33222",https://www.congress.gov/crs-product/RL33222,"Congressional Research Service / U.S. State Department","The annual baseline under the 2016 ten-year MOU.","Emergency supplementals or arms-sale notifications.",source-stated,"The 2016 MOU sets a $3.8B annual U.S. military aid baseline for FY2019-FY2028.","Check if a cited year includes supplemental appropriations."
AID-004,26400000000,USD,Supplemental appropriation,2024,"H.R.815 Israel Security Supplemental",https://www.congress.gov/bill/118th-congress/house-bill/815,"U.S. Congress","The signed supplemental package and legislative source.","Actual delivered weapon quantities or future disbursement timing.",source-stated,"H.R.815 added a $26.4B Israel security supplemental in April 2024.","Separate bill text from later obligation or delivery records."
AID-005,8000000000,USD,Proposed arms sale notification,2025,"DSCA major arms sales notices",https://www.dsca.mil/press-media/major-arms-sales,"Defense Security Cooperation Agency","A proposed sale notification category and official source ladder.","That every notified sale was fully delivered or used in a specific incident.",needs-specific-notice,"DSCA notices should be cited as proposed arms-sale records unless delivery is separately documented.","Attach the exact DSCA notice URL before publication."
